{
  "$schema": "http://json-schema.org/draft-07/schema#",
  "title": "VESSEL Item Definition",
  "type": "array",
  "items": {
    "type": "object",
    "additionalProperties": false,
    "required": ["id", "name", "category", "corruption", "pathAffinity", "tags", "effects"],
    "properties": {
      "id": { "type": "string", "minLength": 1 },
      "name": { "type": "string", "minLength": 1 },
      "category": { "type": "string", "enum": ["offense", "defense", "utility", "economy", "corruption_tech"] },
      "corruption": { "type": "number", "minimum": -100, "maximum": 100 },
      "pathAffinity": { "type": "string", "enum": ["demonic", "ascetic", "unaligned"] },
      "tags": { "type": "array", "minItems": 1, "items": { "type": "string" } },
      "effects": {
        "type": "object",
        "minProperties": 1,
        "additionalProperties": {
          "anyOf": [{ "type": "number" }, { "type": "boolean" }]
        }
      }
    }
  }
}
