[
  {
    "id": "unholy_water",
    "name": "UNHOLY WATER",
    "category": "offense",
    "corruption": 5,
    "tags": [
      "tear",
      "unholy"
    ],
    "effects": {
      "pierce": true
    },
    "pathAffinity": "demonic"
  },
  {
    "id": "goats_eye",
    "name": "GOAT'S EYE",
    "category": "offense",
    "corruption": 10,
    "tags": [
      "unholy",
      "body"
    ],
    "effects": {
      "damage": 1
    },
    "pathAffinity": "demonic"
  },
  {
    "id": "marrow_candle",
    "name": "MARROW CANDLE",
    "category": "offense",
    "corruption": 5,
    "tags": [
      "tear",
      "body"
    ],
    "effects": {
      "tears": 0.5
    },
    "pathAffinity": "unaligned"
  },
  {
    "id": "inverted_cross",
    "name": "INVERTED CROSS",
    "category": "offense",
    "corruption": 25,
    "tags": [
      "unholy",
      "corruption"
    ],
    "effects": {
      "damage": 1,
      "soul": -1
    },
    "pathAffinity": "demonic"
  },
  {
    "id": "blackened_tongue",
    "name": "BLACKENED TONGUE",
    "category": "offense",
    "corruption": 10,
    "tags": [
      "unholy",
      "tear"
    ],
    "effects": {
      "slow": true
    },
    "pathAffinity": "demonic"
  },
  {
    "id": "split_nail",
    "name": "SPLIT NAIL",
    "category": "offense",
    "corruption": 8,
    "tags": [
      "tear"
    ],
    "effects": {
      "split": 2
    },
    "pathAffinity": "unaligned"
  },
  {
    "id": "chain_censer",
    "name": "CHAIN CENSER",
    "category": "offense",
    "corruption": 12,
    "tags": [
      "tear",
      "holy"
    ],
    "effects": {
      "chain": 2
    },
    "pathAffinity": "demonic"
  },
  {
    "id": "burning_stigmata",
    "name": "BURNING STIGMATA",
    "category": "offense",
    "corruption": 15,
    "tags": [
      "body",
      "corruption"
    ],
    "effects": {
      "dot": 0.5
    },
    "pathAffinity": "demonic"
  },
  {
    "id": "siphon_tooth",
    "name": "SIPHON TOOTH",
    "category": "offense",
    "corruption": 12,
    "tags": [
      "unholy",
      "soul"
    ],
    "effects": {
      "siphon": 0.3
    },
    "pathAffinity": "demonic"
  },
  {
    "id": "the_rope",
    "name": "THE ROPE",
    "category": "defense",
    "corruption": 0,
    "tags": [
      "holy"
    ],
    "effects": {
      "extraLife": 1
    },
    "pathAffinity": "ascetic"
  },
  {
    "id": "saints_ash",
    "name": "SAINT'S ASH",
    "category": "defense",
    "corruption": 0,
    "tags": [
      "soul",
      "holy"
    ],
    "effects": {
      "maxSoul": 2,
      "soul": 2
    },
    "pathAffinity": "ascetic"
  },
  {
    "id": "flayed_skin",
    "name": "FLAYED SKIN",
    "category": "defense",
    "corruption": 15,
    "tags": [
      "body",
      "unholy"
    ],
    "effects": {
      "damageReduction": 0.25
    },
    "pathAffinity": "demonic"
  },
  {
    "id": "bone_ward",
    "name": "BONE WARD",
    "category": "defense",
    "corruption": 8,
    "tags": [
      "body",
      "soul"
    ],
    "effects": {
      "maxSoul": 1,
      "damageReduction": 0.1
    },
    "pathAffinity": "unaligned"
  },
  {
    "id": "martyrs_veil",
    "name": "MARTYR'S VEIL",
    "category": "defense",
    "corruption": 3,
    "tags": [
      "holy",
      "body"
    ],
    "effects": {
      "maxSoul": 1,
      "soul": 1
    },
    "pathAffinity": "ascetic"
  },
  {
    "id": "pilgrims_sandals",
    "name": "PILGRIM'S SANDALS",
    "category": "utility",
    "corruption": 0,
    "tags": [
      "body",
      "holy"
    ],
    "effects": {
      "speed": 30
    },
    "pathAffinity": "ascetic"
  },
  {
    "id": "widened_eye",
    "name": "WIDENED EYE",
    "category": "utility",
    "corruption": 5,
    "tags": [
      "body"
    ],
    "effects": {
      "range": 80
    },
    "pathAffinity": "unaligned"
  },
  {
    "id": "swift_tear",
    "name": "SWIFT TEAR",
    "category": "utility",
    "corruption": 3,
    "tags": [
      "tear"
    ],
    "effects": {
      "shotSpeed": 60
    },
    "pathAffinity": "unaligned"
  },
  {
    "id": "cartographers_bone",
    "name": "CARTOGRAPHER'S BONE",
    "category": "utility",
    "corruption": 0,
    "tags": [
      "holy"
    ],
    "effects": {
      "mapReveal": true
    },
    "pathAffinity": "ascetic"
  },
  {
    "id": "tithe_box",
    "name": "TITHE BOX",
    "category": "economy",
    "corruption": 0,
    "tags": [
      "soul",
      "holy"
    ],
    "effects": {
      "soulOnClear": 1
    },
    "pathAffinity": "ascetic"
  },
  {
    "id": "reliquary_key",
    "name": "RELIQUARY KEY",
    "category": "economy",
    "corruption": 5,
    "tags": [
      "holy"
    ],
    "effects": {
      "extraPickup": true
    },
    "pathAffinity": "ascetic"
  },
  {
    "id": "blood_chalice",
    "name": "BLOOD CHALICE",
    "category": "economy",
    "corruption": 10,
    "tags": [
      "soul",
      "unholy"
    ],
    "effects": {
      "siphon": 0.2
    },
    "pathAffinity": "demonic"
  },
  {
    "id": "void_heart",
    "name": "VOID HEART",
    "category": "corruption_tech",
    "corruption": 20,
    "tags": [
      "corruption",
      "soul"
    ],
    "effects": {
      "corruptionDamageScale": true
    },
    "pathAffinity": "demonic"
  },
  {
    "id": "penitent_thorns",
    "name": "PENITENT THORNS",
    "category": "corruption_tech",
    "corruption": -10,
    "tags": [
      "corruption",
      "holy"
    ],
    "effects": {
      "damage": -0.3,
      "maxSoul": 1
    },
    "pathAffinity": "ascetic"
  },
  {
    "id": "blackened_halo",
    "name": "BLACKENED HALO",
    "category": "corruption_tech",
    "corruption": 30,
    "tags": [
      "corruption",
      "unholy"
    ],
    "effects": {
      "aura": 1.5
    },
    "pathAffinity": "demonic"
  },
  {
    "id": "vessels_echo",
    "name": "VESSEL'S ECHO",
    "category": "corruption_tech",
    "corruption": 15,
    "tags": [
      "corruption",
      "tear"
    ],
    "effects": {
      "corruptionTearBonus": true
    },
    "pathAffinity": "demonic"
  }
]
